{"draft_id":"11111111-1111-4111-8111-111111111111","mapping_id":"gen-data-canonical-observation","mapping_version":"v2","mapping_sha256":"2222222222222222222222222222222222222222222222222222222222222222","logical_uri":"ontology/mappings/gen-data-canonical-observation/v2/mapping.json","published_at":"2026-09-01T00:01:00Z","idempotent":false}
